rubric_id,domain,evaluation_criteria,weight_distribution,level_1_criteria,level_2_criteria,level_3_criteria,level_4_criteria,level_5_criteria,score_1_3_descriptor,score_4_6_descriptor,score_7_10_descriptor,auto_fail_triggers,bonus_indicators,conflict_check_required,bias_audit_frequency,evaluator_notes
RUB-TECH,Technical,Correctness|Code quality|Best practices|Efficiency|Error handling,Correctness:40|Quality:25|Best Practices:20|Efficiency:15,No solution attempted. Cannot explain the concept or its purpose.,Partially correct solution with significant gaps. Misses best practices. No error handling.,Correct solution for common cases. Applies standard best practices. Some edge cases missed.,"Correct, efficient, and well-structured. Handles edge cases. Explains trade-offs clearly.","Optimal solution with deep reasoning. Discusses architectural alternatives, complexity, and real-world constraints.",Incorrect or no solution. Cannot explain reasoning.,Partially correct. Some best practices. Misses edge cases.,"Correct, efficient, well-structured. Handles edge cases. Explains trade-offs.",Completely wrong answer on fundamental concept|Plagiarism detected|Cannot explain basic syntax|Blank response,Proposes novel optimization|References production battle-tested experience|Discusses complexity trade-offs|Open-source contribution mentioned,Optional,Every 500 evaluations,Calibrate against answer_calibration.csv for Technical domain.
RUB-BEHA,Behavioral,STAR structure|Specificity|Impact|Self-awareness|Growth mindset,STAR:30|Specificity:25|Impact:25|Reflection:20,Vague or no example given. Deflects responsibility. No structure.,Weak STAR structure. Generic example. Limited personal ownership or insight.,Clear STAR structure. Specific example. Adequate reflection on outcome.,Strong STAR with quantified impact. Clear ownership and lessons learned.,"Exemplary STAR with measurable business impact, self-awareness, and systemic improvement demonstrated.",Vague or generic. No specific examples. Deflects responsibility.,Some structure. Moderate specificity. Limited reflection.,"Clear STAR format. Specific, quantified impact. Strong self-awareness and lessons learned.",No specific example provided after prompt|Blames others entirely without self-reflection|Fabricated scenario detected|Blank response,Quantified measurable impact|Systemic change resulted from experience|Clear growth demonstrated|Cross-functional leadership shown,Yes,Every 500 evaluations,Calibrate against answer_calibration.csv for Behavioral domain.
RUB-SYST,System Design,Scalability|Reliability|Maintainability|Trade-off analysis|Communication,Scalability:30|Reliability:25|Trade-offs:25|Communication:20,No coherent design. Cannot identify components or trade-offs.,"Basic design with single-server thinking. Ignores scale, reliability, or maintainability.",Functional design addressing core requirements. Some scaling and fault tolerance considered.,"Comprehensive design with scalability, reliability, and trade-off analysis. Well-communicated.","Production-grade design. Covers data flow, SLOs, failure modes, cost, and global distribution.",No coherent design. Ignores scale. Cannot articulate trade-offs.,Basic design. Considers some scaling factors. Limited trade-off discussion.,Comprehensive design. Addresses all pillars. Clear trade-off analysis with justification.,Completely ignores scalability|No coherent design proposed|Fatal flaw in data model|Blank response,Addresses global distribution unprompted|Discusses cost optimization|Covers SLO/SLA proactively|Mentions chaos engineering,Optional,Every 500 evaluations,Calibrate against answer_calibration.csv for System Design domain.
RUB-PROB,Problem Solving,Approach|Optimization|Correctness|Complexity analysis|Communication,Correctness:35|Optimization:30|Complexity:20|Communication:15,No approach identified. Cannot solve even with hints.,Brute-force approach only. Correct output but O(n²) or worse. No complexity awareness.,Reasonable approach. Correct solution. Basic complexity analysis (O(n log n) or better).,Optimal approach with clear complexity analysis. Considers space/time trade-offs.,Multiple approaches compared. Optimal chosen with proof. Edge cases and constraints fully handled.,No clear approach. Incorrect solution. Cannot analyze complexity.,Reasonable approach. Brute force. Basic complexity awareness.,Optimal approach. Correct. Clear O(n) analysis. Alternative solutions discussed.,Cannot decompose the problem|Random guessing with no reasoning|Completely wrong algorithmic approach|Blank response,Identifies multiple valid approaches and picks the best|Considers edge cases proactively|Discusses time and space complexity|Optimizes after initial solution,Optional,Every 500 evaluations,Calibrate against answer_calibration.csv for Problem Solving domain.
RUB-DOMA,Domain Knowledge,Breadth|Depth|Recency|Application|Industry alignment,Depth:35|Application:30|Recency:20|Breadth:15,Superficial or incorrect knowledge. Cannot go beyond the definition.,Basic understanding of concepts. No awareness of current practices or real applications.,Solid foundational knowledge. Some practical application. Aware of recent developments.,Deep expertise with strong application examples. Up-to-date. Can compare approaches.,Expert-level breadth and depth. References primary sources. Demonstrates original thinking.,Superficial knowledge. Outdated or inaccurate information.,Solid fundamentals. Limited awareness of recent developments.,Expert-level breadth and depth. Up-to-date. Strong practical application examples.,Fundamental domain misconception|Ignores core regulatory or compliance context|No industry awareness|Blank response,References specific regulation or standard|Competitive landscape awareness|Novel domain insight|Cross-domain application,Optional,Every 500 evaluations,Calibrate against answer_calibration.csv for Domain Knowledge domain.
RUB-SOFT,Soft Skills,Communication|Empathy|Leadership|Adaptability|Conflict Resolution,Communication:30|Empathy:20|Leadership:20|Adaptability:15|Conflict:15,Poor communication. Lacks empathy. Cannot adapt to feedback.,Basic communication. Shows some empathy but struggles with leadership or conflict.,Clear communication. Demonstrates empathy and basic leadership. Adapts well to feedback.,Strong communicator. Empathetic leader. Handles conflict professionally. Highly adaptable.,Exceptional communicator and leader. Inspires others. Masterful conflict resolution and adaptability.,Poor communication. Lacks empathy.,Basic communication. Some empathy.,Strong communicator. Empathetic leader. Professional conflict resolution.,No specific example after prompting|Pure deflection of responsibility|Hostile or dismissive response|Blank response,Quantified business impact|Systemic improvement implemented|Cross-team influence demonstrated|Consistent pattern across examples,Yes,Every 500 evaluations,Calibrate for Soft Skills domain.
RUB-LEAD,Leadership,Vision|Strategy|Team Building|Execution|Mentorship,Vision:25|Strategy:25|Team:20|Execution:15|Mentorship:15,No clear vision or strategy. Struggles to build or lead a team.,Basic vision. Limited strategic thinking. Can lead a small team with guidance.,Clear vision and strategy. Successfully builds and leads teams. Mentors others.,Strong visionary and strategist. High-performing team builder. Proven execution and mentorship.,Transformational leader. Shapes industry-level strategy. Builds world-class teams. Master mentor.,No vision. Poor leadership.,Basic vision. Limited strategy.,Strong vision. Proven team leadership and mentorship.,Claims zero leadership experience at senior level|Dismisses importance of team dynamics|No examples of decision-making|Blank response,Developed others who grew beyond initial scope|Built measurable team culture change|Led cross-org initiative|Successful turnaround story,Yes,Every 500 evaluations,Calibrate for Leadership domain.
RUB-DATA,Data Science,Statistical Rigor|Modeling|Data Intuition|Visualization|Business Impact,Rigor:25|Modeling:25|Intuition:20|Viz:15|Impact:15,Lacks statistical knowledge. Poor modeling choices. No data intuition.,Basic stats and modeling. Limited data intuition or visualization skills.,Solid statistical foundation. Appropriate modeling. Good data intuition and viz.,Advanced statistical rigor. Expert modeling. Strong data intuition and business impact.,Pioneering data science work. Novel modeling techniques. Exceptional business impact and viz.,Lacks rigor. Poor modeling.,Basic stats. Limited intuition.,Advanced rigor. Expert modeling. Strong business impact.,Fundamental statistics error|Confuses correlation with causation|No mention of model validation|Blank response,Discusses model interpretability unprompted|Addresses data leakage|References A/B testing methodology|Considers model drift,Optional,Every 500 evaluations,Calibrate for Data Science domain.
